{
  "$contract": "soter://contracts/evidence/v2",
  "contractVersion": "2.0.0",
  "id": "evidence.meeting-intake.legacy-ingestion-meeting-migration.fixture",
  "createdAt": "2026-07-15T12:00:00.000Z",
  "claimFamily": "migration",
  "claim": "The exact target becomes canonical for this legacy responsibility and its fallback may be removed under the recorded parity decision; a mixed source artifact may remain only for separately unfinished responsibilities.",
  "subject": {
    "type": "pack",
    "id": "automation.meeting-intake",
    "version": "0.1.0"
  },
  "configurationLockFingerprint": "sha256:f306a42577417c7340471a01729342d334c444b3d2d2fc98fb83e79a7ea3a0c4",
  "graphFingerprint": "sha256:613b55e47f4a23d5ad22c552ad0233108f11e2d5a39dc19297128455dd4b192c",
  "dependencies": [
    {
      "id": "kernel.soter",
      "version": "0.1.0",
      "fingerprint": "sha256:59ce748c07769a88687849dbf900a9a295a16daf314fa911055b2996effd59f6"
    },
    {
      "id": "core.runtime",
      "version": "0.1.0",
      "fingerprint": "sha256:a9c8dae0de0211a02104bbc93a94ea5021bdeadb84040dfe88778288ee465a92"
    },
    {
      "id": "context.crm",
      "version": "0.1.0",
      "fingerprint": "sha256:fa69fc9f796e84b1a2cd7e319c4344dcc44d8dcbea9542e51158eb868d266f44"
    },
    {
      "id": "context.meetings",
      "version": "0.1.0",
      "fingerprint": "sha256:151852f16515b5d3b48508ff15bbf38107a1333f3ee10a6b6579fadb4ee64164"
    },
    {
      "id": "context.projects",
      "version": "0.1.0",
      "fingerprint": "sha256:e8b68449ec9582d769c56d9b9cdf9ed3a6f220c15593a614ac13e9a656cf0ce5"
    },
    {
      "id": "context.tasks",
      "version": "0.1.0",
      "fingerprint": "sha256:5d516369250d03e1a270d7ac6c0dfe3a19d790eafab4a7971e1b11a36d282555"
    },
    {
      "id": "automation.meeting-intake",
      "version": "0.1.0",
      "fingerprint": "sha256:4f39b7bae165899b915085db78ceb67efb86d72f6624879b9571d90e6a017fae"
    },
    {
      "id": "integration.notion",
      "version": "0.2.0",
      "fingerprint": "sha256:6fb5e52744fb5f8e2a9274cb41dae11c59bc940c62ffecce8431f8032a47c7b5"
    },
    {
      "id": "integration.otter",
      "version": "0.1.0",
      "fingerprint": "sha256:2b026b4426d72cab08f667f36e219be74664913634b175ab79b0f040f192e07b"
    }
  ],
  "host": {
    "id": "codex",
    "adapter": "host.codex",
    "version": "0.3.1",
    "manifestFingerprint": "sha256:3bed5add21c2b59945de26b49f5216d666632df194bb5be24fb6b1a8a3602ba0"
  },
  "integrations": [
    {
      "id": "integration.notion",
      "version": "0.2.0",
      "manifestFingerprint": "sha256:6fb5e52744fb5f8e2a9274cb41dae11c59bc940c62ffecce8431f8032a47c7b5",
      "evidenceMaturity": "declared"
    },
    {
      "id": "integration.otter",
      "version": "0.1.0",
      "manifestFingerprint": "sha256:2b026b4426d72cab08f667f36e219be74664913634b175ab79b0f040f192e07b",
      "evidenceMaturity": "declared"
    }
  ],
  "authorities": [
    {
      "id": "authority.crm.definition",
      "role": "definition",
      "subject": "crm.records",
      "declarationFingerprint": "sha256:bb8707ba433f49d40250874f67667e8e3fb9243ba31895b026d530750f2c7b88"
    },
    {
      "id": "authority.crm.instance",
      "role": "instance",
      "subject": "crm.records",
      "declarationFingerprint": "sha256:23a6dd9d0b3aa51376f36403b34c0e0530399afab401429e72b3a30eddf14e11"
    },
    {
      "id": "authority.meetings.definition",
      "role": "definition",
      "subject": "meetings.records",
      "declarationFingerprint": "sha256:98e080ad675a7d7ba10d62449164df4b2b7774f5fec5a6f8ab8c02213caeb7c6"
    },
    {
      "id": "authority.meetings.instance",
      "role": "instance",
      "subject": "meetings.records",
      "declarationFingerprint": "sha256:8abd68d26f22693f3573546c995297998e5655b35ac6c21524e3b548ecddce60"
    },
    {
      "id": "authority.notion.provider",
      "role": "provider",
      "subject": "notion.workspace",
      "declarationFingerprint": "sha256:e3e11d347b7a0109668facaeb7b12311023da39949d1328bfd918c53a406c756"
    },
    {
      "id": "authority.otter.provider",
      "role": "provider",
      "subject": "meeting.transcript",
      "declarationFingerprint": "sha256:b2acdfc57c3b02106dcfe5c7b9e6838548a644c6e8927999d7a051057ba64331"
    },
    {
      "id": "authority.projects.definition",
      "role": "definition",
      "subject": "projects.records",
      "declarationFingerprint": "sha256:fce3445f679b41227242b5dbc7fafd2cb86c9a95020d887a50c5df612eee0f83"
    },
    {
      "id": "authority.projects.instance",
      "role": "instance",
      "subject": "projects.records",
      "declarationFingerprint": "sha256:97b91257bdd2ef42a8ce3efcb23bc86d5a337118c9d81058af64035b7e7a0aa6"
    },
    {
      "id": "authority.run.evidence",
      "role": "evidence",
      "subject": "runtime.runs",
      "declarationFingerprint": "sha256:6f39e99f1ebc86fe11ee09cc7170824ac4c11a6fc88371edb673bd2379dacdc8"
    },
    {
      "id": "authority.tasks.definition",
      "role": "definition",
      "subject": "tasks.records",
      "declarationFingerprint": "sha256:88a0f55602be20f6491a2faf0180ed8b16b309f23d937f41878065bd784358bb"
    },
    {
      "id": "authority.tasks.instance",
      "role": "instance",
      "subject": "tasks.records",
      "declarationFingerprint": "sha256:dcb3e8d127b4bcc04235daa8426dce206db992719e80880e7fb994f670cf1d8a"
    }
  ],
  "evaluator": {
    "id": "kernel.legacy-migration-completion",
    "version": "1.0.0",
    "level": "fixture"
  },
  "environment": {
    "containment": "fixture",
    "runtime": "node"
  },
  "acceptanceCriteria": [
    "The exact migration target is selected by and fingerprinted in the current configuration lock.",
    "Every artifact labeled as same-lock supporting evidence passed against the exact configuration lock and stable semantic graph; separately labeled supporting artifacts are fingerprint-bound without a same-lock claim.",
    "The complete inventory records the exact target authority or retirement, parity decision, fallback removal, evidence reference, and either a completed source tombstone or one completed responsibility inside a retained mixed source.",
    "The Meeting guide, all three executable Meeting evaluation sources, and mixed Ingestion card are removed, so no legacy source can restore the Meeting workflow.",
    "Meeting Intake remains target-owned after every remaining Ingestion responsibility was resolved and the mixed card became a tombstone."
  ],
  "result": "passed",
  "outcomes": [
    {
      "id": "migration-disposition",
      "state": "migrated"
    },
    {
      "id": "migration-parity",
      "state": "intentional-change"
    },
    {
      "id": "target-selected-in-exact-lock",
      "state": "passed"
    },
    {
      "id": "supporting-evidence-current",
      "state": "passed"
    },
    {
      "id": "authority-transition-explicit",
      "state": "passed"
    },
    {
      "id": "legacy-dependencies-cleared",
      "state": "passed"
    },
    {
      "id": "mixed-source-responsibility-isolated",
      "state": "passed"
    }
  ],
  "artifacts": [
    {
      "role": "migration-source",
      "path": ".claude/systems/ingestion.md",
      "fingerprint": "sha256:9b5a832fd254d33d4340952c5a8a07143db9f160a66c4b3da0842b71c5cd40b1"
    },
    {
      "role": "migration-target",
      "path": "soter/packs/automation.meeting-intake/pack.json",
      "fingerprint": "sha256:4f39b7bae165899b915085db78ceb67efb86d72f6624879b9571d90e6a017fae"
    },
    {
      "role": "supporting-evidence",
      "path": "soter/fixtures/meeting-intake/review-preparation.evidence.json",
      "fingerprint": "sha256:aac7f51f3de60a0e50f2da1ab0ba9ff37a7b9324d13115359e0bffd7ef72ffa4"
    },
    {
      "role": "supporting-artifact",
      "path": "soter/fixtures/meeting-intake/connected-review.evidence.json",
      "fingerprint": "sha256:69bde36e51f89e8a5acb52f0806588a23dd390180f8340cf8ba8d3d4e06664ef"
    }
  ],
  "effects": [],
  "failures": [],
  "warnings": [],
  "skipped": [
    "Connected provider readiness, live behavior verification, and current health were not evaluated.",
    "Removing a legacy source fallback does not grant provider effect or host execution authority."
  ],
  "limitations": [
    "The removed Ingestion card is retained only as an exact governed tombstone and grants no workflow authority."
  ],
  "freshness": {
    "policy": "Valid only while every configuration-lock fingerprint remains unchanged.",
    "validUntil": null
  },
  "supersedes": null,
  "privacy": {
    "scope": "private",
    "redactions": [
      "Credential references and credential values are excluded."
    ]
  }
}
