{
  "$contract": "soter://contracts/evidence/v2",
  "contractVersion": "2.0.0",
  "id": "evidence.repository-review.legacy-guide-migration.fixture",
  "createdAt": "2026-07-21T20:00:00.000Z",
  "claimFamily": "migration",
  "claim": "The exact target becomes canonical for this legacy responsibility and its fallback may be removed under the recorded parity decision; a mixed source artifact may remain only for separately unfinished responsibilities.",
  "subject": {
    "type": "pack",
    "id": "automation.repository-review",
    "version": "0.1.0"
  },
  "configurationLockFingerprint": "sha256:6628befe9e02043a3f1caa0b547d686631cc4d25468e76d5b9b40876bf61a6fb",
  "graphFingerprint": "sha256:5dea147a605397681ec98c1ac569276edf2f7c2f81eca11ea4992dce77ad0868",
  "dependencies": [
    {
      "id": "kernel.soter",
      "version": "0.1.0",
      "fingerprint": "sha256:59ce748c07769a88687849dbf900a9a295a16daf314fa911055b2996effd59f6"
    },
    {
      "id": "core.runtime",
      "version": "0.1.0",
      "fingerprint": "sha256:a9c8dae0de0211a02104bbc93a94ea5021bdeadb84040dfe88778288ee465a92"
    },
    {
      "id": "context.product",
      "version": "0.1.0",
      "fingerprint": "sha256:962e1ee9a1d70e1ffc1e5dd2118c6264817115e1030ece09d50c8700d25525c9"
    },
    {
      "id": "automation.repository-review",
      "version": "0.1.0",
      "fingerprint": "sha256:1083a2ff9d155594e9cc9a7ef0f8b76a00af24956c9625bd0207d660430749bb"
    },
    {
      "id": "integration.local-repository",
      "version": "0.1.0",
      "fingerprint": "sha256:e25565edcb5907b79742fa83b7b0d8c2248e5fa4edd9656482441cb297e79269"
    },
    {
      "id": "integration.notion",
      "version": "0.2.0",
      "fingerprint": "sha256:6fb5e52744fb5f8e2a9274cb41dae11c59bc940c62ffecce8431f8032a47c7b5"
    }
  ],
  "host": {
    "id": "codex",
    "adapter": "host.codex",
    "version": "0.3.1",
    "manifestFingerprint": "sha256:3bed5add21c2b59945de26b49f5216d666632df194bb5be24fb6b1a8a3602ba0"
  },
  "integrations": [
    {
      "id": "integration.local-repository",
      "version": "0.1.0",
      "manifestFingerprint": "sha256:e25565edcb5907b79742fa83b7b0d8c2248e5fa4edd9656482441cb297e79269",
      "evidenceMaturity": "declared"
    },
    {
      "id": "integration.notion",
      "version": "0.2.0",
      "manifestFingerprint": "sha256:6fb5e52744fb5f8e2a9274cb41dae11c59bc940c62ffecce8431f8032a47c7b5",
      "evidenceMaturity": "declared"
    }
  ],
  "authorities": [
    {
      "id": "authority.notion.provider",
      "role": "provider",
      "subject": "notion.workspace",
      "declarationFingerprint": "sha256:98fd45b601c22716464315cbbc969b87e603026880645bd7695fcc90029d1d44"
    },
    {
      "id": "authority.product.definition",
      "role": "definition",
      "subject": "product.records",
      "declarationFingerprint": "sha256:b684b06cd81025f9200595cb311a091e023a5dc0226e888c51c92ef47f26fabc"
    },
    {
      "id": "authority.product.instance",
      "role": "instance",
      "subject": "product.records",
      "declarationFingerprint": "sha256:2dda21f1d42f1557b4239048540e7317ff2bf2e4c2a48215c8e1e27878f3c1a1"
    },
    {
      "id": "authority.repository.instance",
      "role": "instance",
      "subject": "repository.source",
      "declarationFingerprint": "sha256:b6e43b564aefec3b03c5db900b13bc2c5225075b03fb130c0f4d902295c765d1"
    },
    {
      "id": "authority.run.evidence",
      "role": "evidence",
      "subject": "runtime.runs",
      "declarationFingerprint": "sha256:74c8fdd14e981038f959c469d6709fe66186b5f854f5f337f65bc67a6e7926c0"
    }
  ],
  "evaluator": {
    "id": "kernel.legacy-migration-completion",
    "version": "1.0.0",
    "level": "fixture"
  },
  "environment": {
    "containment": "fixture",
    "runtime": "node"
  },
  "acceptanceCriteria": [
    "The exact migration target is selected by and fingerprinted in the current configuration lock.",
    "Every artifact labeled as same-lock supporting evidence passed against the exact configuration lock and stable semantic graph; separately labeled supporting artifacts are fingerprint-bound without a same-lock claim.",
    "The complete inventory records the exact target authority or retirement, parity decision, fallback removal, evidence reference, and either a completed source tombstone or one completed responsibility inside a retained mixed source.",
    "No retained legacy artifact requires the removed guide by exact path, and the removed Ingestion card has an exact Repository Review target binding in its migration tombstone.",
    "The target owns typed private input, exact repository and Product reads, itemized review, duplicate visibility, private handoffs, and no-authority preparation.",
    "The migration declares no proposal adapter or connected compiler and cannot create a tooling page, feature card, approval, continuation, or provider write.",
    "Current fixture evidence passes exact source selection, non-README grounding, consistent altitude, duplicate hold, complete private handoffs, path confinement, privacy, and zero-write cases."
  ],
  "result": "passed",
  "outcomes": [
    {
      "id": "migration-disposition",
      "state": "migrated"
    },
    {
      "id": "migration-parity",
      "state": "intentional-change"
    },
    {
      "id": "target-selected-in-exact-lock",
      "state": "passed"
    },
    {
      "id": "supporting-evidence-current",
      "state": "passed"
    },
    {
      "id": "authority-transition-explicit",
      "state": "passed"
    },
    {
      "id": "legacy-dependencies-cleared",
      "state": "passed"
    },
    {
      "id": "complete-preparation-path-declared",
      "state": "passed"
    },
    {
      "id": "external-writes-intentionally-unavailable",
      "state": "passed"
    },
    {
      "id": "contained-repository-review-cases-passed",
      "state": "passed"
    }
  ],
  "artifacts": [
    {
      "role": "migration-source",
      "path": ".claude/skills/reviewing-a-repo/SKILL.md",
      "fingerprint": "sha256:3b93777301d2cd762408fc1fccdae428f7c7eb46525c25e4c4a808bb37af3f9f"
    },
    {
      "role": "migration-target",
      "path": "soter/packs/automation.repository-review/pack.json",
      "fingerprint": "sha256:1083a2ff9d155594e9cc9a7ef0f8b76a00af24956c9625bd0207d660430749bb"
    },
    {
      "role": "supporting-evidence",
      "path": "soter/fixtures/repository-review/preparation.evidence.json",
      "fingerprint": "sha256:67b4c2405413ed40ab64d99116e62f8bfecd7855a099a9dda09c48aafa2b8c28"
    }
  ],
  "effects": [],
  "failures": [],
  "warnings": [],
  "skipped": [
    "Connected provider readiness, live behavior verification, and current health were not evaluated.",
    "Removing a legacy source fallback does not grant provider effect or host execution authority."
  ],
  "limitations": [
    "The target intentionally replaces direct tooling-page and feature writes with private handoffs to Feature Capture; tooling records remain unavailable until portable meaning and a separate exact transaction exist.",
    "The contained fixture proves no connected repository access, Git behavior, Notion authentication, provider conformance, Product write, readiness, verification, or health."
  ],
  "freshness": {
    "policy": "Valid only while every configuration-lock fingerprint remains unchanged.",
    "validUntil": null
  },
  "supersedes": null,
  "privacy": {
    "scope": "private",
    "redactions": [
      "Credential references and credential values are excluded."
    ]
  }
}
